{
  "$schema": "https://json-schema.org/draft/2020-12/schema",
  "$id": "https://geo-market-watch/schemas/analysis-output.json",
  "title": "Geo Market Watch Analysis Output",
  "description": "Top-level structured output for deep geopolitical market analysis.",
  "type": "object",
  "additionalProperties": true,
  "required": [
    "analysis_id",
    "generated_at",
    "language",
    "mode",
    "event",
    "confirmed_facts",
    "market_interpretation",
    "scenario_analysis",
    "watchlist",
    "risk_flags"
  ],
  "properties": {
    "analysis_id": {
      "type": "string",
      "pattern": "^analysis-[0-9]{4}-[0-9]{4,}$"
    },
    "generated_at": {
      "type": "string",
      "format": "date-time"
    },
    "language": {
      "type": "string",
      "enum": ["zh-CN", "en", "bilingual"]
    },
    "mode": {
      "type": "string",
      "enum": ["link_mode", "discovery_mode"]
    },
    "event": {
      "$ref": "event-object.json"
    },
    "confirmed_facts": {
      "type": "array",
      "description": "Facts believed to be confirmed enough for inclusion in the confirmed facts section.",
      "minItems": 1,
      "items": {
        "$ref": "#/$defs/fact"
      }
    },
    "market_interpretation": {
      "type": "array",
      "description": "Core market interpretations derived from the event and available evidence.",
      "minItems": 1,
      "items": {
        "$ref": "#/$defs/interpretation"
      }
    },
    "scenario_analysis": {
      "type": "array",
      "description": "Scenario tree with directional implications and confidence.",
      "minItems": 1,
      "items": {
        "$ref": "#/$defs/scenario"
      }
    },
    "watchlist": {
      "type": "array",
      "minItems": 1,
      "items": {
        "$ref": "watchlist-item.json"
      }
    },
    "risk_flags": {
      "type": "array",
      "description": "High-level flags that communicate analysis caveats or system concerns.",
      "items": {
        "type": "string",
        "enum": [
          "fog_of_war",
          "single_source_risk",
          "contradictory_reporting",
          "weak_market_mapping",
          "low_confidence_watchlist",
          "headline_only",
          "timing_uncertainty",
          "other"
        ]
      },
      "uniqueItems": true
    },
    "executive_summary": {
      "type": "string",
      "minLength": 20,
      "maxLength": 3000
    },
    "propagation_chain": {
      "type": "array",
      "description": "Ordered chain showing how the event propagates into market consequences.",
      "items": {
        "$ref": "#/$defs/propagationStep"
      }
    },
    "next_monitoring_points": {
      "type": "array",
      "description": "What the system or analyst should monitor next.",
      "items": {
        "$ref": "#/$defs/monitoringPoint"
      }
    },
    "source_notes": {
      "type": "array",
      "description": "Optional notes on source quality, conflicts, or missing information.",
      "items": {
        "type": "string",
        "minLength": 5,
        "maxLength": 1000
      }
    },
    "metadata": {
      "type": "object",
      "additionalProperties": false,
      "properties": {
        "agent_version": {
          "type": "string",
          "minLength": 1,
          "maxLength": 50
        },
        "schema_version": {
          "type": "string",
          "minLength": 1,
          "maxLength": 50
        },
        "analysis_duration_ms": {
          "type": "integer",
          "minimum": 0
        },
        "input_source_count": {
          "type": "integer",
          "minimum": 1
        }
      }
    }
  },
  "$defs": {
    "fact": {
      "type": "object",
      "additionalProperties": false,
      "required": ["statement", "confidence_level"],
      "properties": {
        "statement": {
          "type": "string",
          "minLength": 5,
          "maxLength": 1000
        },
        "confidence_level": {
          "type": "string",
          "enum": ["low", "medium", "high"]
        },
        "source_ids": {
          "type": "array",
          "items": {
            "type": "string",
            "minLength": 1,
            "maxLength": 100
          },
          "uniqueItems": true
        }
      }
    },
    "interpretation": {
      "type": "object",
      "additionalProperties": false,
      "required": ["statement", "market_domains", "confidence_level"],
      "properties": {
        "statement": {
          "type": "string",
          "minLength": 10,
          "maxLength": 1500
        },
        "market_domains": {
          "type": "array",
          "items": {
            "type": "string",
            "minLength": 2,
            "maxLength": 100
          },
          "minItems": 1,
          "uniqueItems": true
        },
        "confidence_level": {
          "type": "string",
          "enum": ["low", "medium", "high"]
        }
      }
    },
    "scenario": {
      "type": "object",
      "additionalProperties": false,
      "required": ["scenario_name", "description", "probability_band", "market_implication"],
      "properties": {
        "scenario_name": {
          "type": "string",
          "minLength": 2,
          "maxLength": 100
        },
        "description": {
          "type": "string",
          "minLength": 10,
          "maxLength": 1500
        },
        "probability_band": {
          "type": "string",
          "enum": ["low", "medium", "high"]
        },
        "market_implication": {
          "type": "string",
          "minLength": 10,
          "maxLength": 1500
        },
        "key_signposts": {
          "type": "array",
          "items": {
            "type": "string",
            "minLength": 3,
            "maxLength": 300
          },
          "uniqueItems": true
        }
      }
    },
    "propagationStep": {
      "type": "object",
      "additionalProperties": false,
      "required": ["step_order", "from_node", "relationship", "to_node"],
      "properties": {
        "step_order": {
          "type": "integer",
          "minimum": 1
        },
        "from_node": {
          "type": "string",
          "minLength": 2,
          "maxLength": 200
        },
        "relationship": {
          "type": "string",
          "enum": [
            "disrupts",
            "delays",
            "reroutes",
            "tightens_supply",
            "raises_cost",
            "reduces_output",
            "supports_substitute",
            "increases_uncertainty",
            "other"
          ]
        },
        "to_node": {
          "type": "string",
          "minLength": 2,
          "maxLength": 200
        },
        "note": {
          "type": "string",
          "maxLength": 500
        }
      }
    },
    "monitoringPoint": {
      "type": "object",
      "additionalProperties": false,
      "required": ["description", "priority"],
      "properties": {
        "description": {
          "type": "string",
          "minLength": 10,
          "maxLength": 1000
        },
        "priority": {
          "type": "string",
          "enum": ["low", "medium", "high"]
        }
      }
    }
  }
}
